{
  "schemaVersion": 9,
  "stage": "high level design",
  "userFlows": [
    {
      "name": "Import a workbook",
      "steps": [
        {
          "id": 1,
          "text": "The user picks a workbook and starts the import."
        },
        {
          "id": 2,
          "text": "The app reads the workbook and parses each sheet, recording a warning for every cell it cannot read."
        },
        {
          "id": 3,
          "text": "The app reports the outcome, including the rows imported, the rows skipped, and any stage that failed."
        }
      ]
    },
    {
      "name": "Confirm the column mapping",
      "steps": [
        {
          "id": 1,
          "text": "The app proposes a column mapping for the sheet being imported."
        },
        {
          "id": 2,
          "text": "The user confirms the proposal or corrects it."
        },
        {
          "id": 3,
          "text": "The app coerces each cell using the confirmed mapping and records the mapped rows on the run."
        }
      ]
    }
  ],
  "classes": [
    {
      "name": "ImportOrchestrator",
      "generalDescription": "Coordinates workbook imports and retains the result of each run.",
      "designRole": "Connects workbook reading and column mapping, accumulates mapped rows, and reports the import outcome to the user.",
      "changeType": "modified",
      "stateVariables": [
        {
          "name": "result",
          "changeType": "unchanged",
          "userFlow": true
        }
      ],
      "methods": [
        {
          "name": "run",
          "generalDescription": "Executes a workbook import using the selected file and import options.",
          "designRole": "Passes parsed sheets to the mapper and stores the completed run in result so the outcome can be displayed again.",
          "userFlow": true,
          "changeType": "modified"
        },
        {
          "name": "planStages",
          "generalDescription": "Builds the ordered stages of an import run.",
          "designRole": "Determines which sheets to open, their read order, and which may be skipped so failures can be attributed to a stage.",
          "userFlow": true,
          "changeType": "added"
        },
        {
          "name": "handleStageFailure",
          "generalDescription": "Processes stage failures and prepares the run outcome for display.",
          "designRole": "Uses the diagnostic summary to report imported rows, skipped rows, and any failed stage to the Import Panel.",
          "userFlow": true,
          "changeType": "modified"
        }
      ],
      "variableExposure": [
        {
          "name": "result",
          "kind": "instance",
          "declaredAt": {
            "file": "src/import/import-orchestrator.ts",
            "line": 20,
            "column": 7
          }
        },
        {
          "name": "buffer1",
          "kind": "instance",
          "declaredAt": {
            "file": "src/import/import-orchestrator.ts",
            "line": 24,
            "column": 5
          }
        },
        {
          "name": "retries2",
          "kind": "instance",
          "declaredAt": {
            "file": "src/import/import-orchestrator.ts",
            "line": 28,
            "column": 7
          }
        },
        {
          "name": "options",
          "kind": "local",
          "method": "run",
          "declaredAt": {
            "file": "src/import/import-orchestrator.ts",
            "line": 274,
            "column": 8
          }
        },
        {
          "name": "target1",
          "kind": "parameter",
          "method": "run",
          "declaredAt": {
            "file": "src/import/import-orchestrator.ts",
            "line": 259,
            "column": 11
          }
        },
        {
          "name": "state2",
          "kind": "local",
          "method": "run",
          "declaredAt": {
            "file": "src/import/import-orchestrator.ts",
            "line": 185,
            "column": 14
          }
        },
        {
          "name": "target3",
          "kind": "local",
          "method": "run",
          "declaredAt": {
            "file": "src/import/import-orchestrator.ts",
            "line": 148,
            "column": 10
          }
        },
        {
          "name": "context",
          "kind": "local",
          "method": "handleStageFailure",
          "declaredAt": {
            "file": "src/import/import-orchestrator.ts",
            "line": 150,
            "column": 7
          }
        },
        {
          "name": "payload1",
          "kind": "local",
          "method": "handleStageFailure",
          "declaredAt": {
            "file": "src/import/import-orchestrator.ts",
            "line": 120,
            "column": 5
          }
        },
        {
          "name": "logger2",
          "kind": "local",
          "method": "handleStageFailure",
          "declaredAt": {
            "file": "src/import/import-orchestrator.ts",
            "line": 283,
            "column": 7
          }
        },
        {
          "name": "options3",
          "kind": "parameter",
          "method": "handleStageFailure",
          "declaredAt": {
            "file": "src/import/import-orchestrator.ts",
            "line": 251,
            "column": 10
          }
        }
      ],
      "variableExposureCount": 11
    },
    {
      "name": "WorkbookReader",
      "generalDescription": "Reads workbook files and makes their sheets available for parsing.",
      "designRole": "Opens the selected workbook, streams sheet rows to the parser, and retains the current decoded sheet alongside run diagnostics.",
      "changeType": "modified",
      "stateVariables": [
        {
          "name": "buffer",
          "changeType": "unchanged",
          "userFlow": true
        }
      ],
      "methods": [
        {
          "name": "open",
          "generalDescription": "Opens a workbook file and reads its contents.",
          "designRole": "Reads the selected file from disk according to the stage plan, with a read error ending the run before sheet parsing.",
          "userFlow": true,
          "changeType": "modified"
        },
        {
          "name": "readSheet",
          "generalDescription": "Decodes a workbook sheet and supplies its rows for parsing.",
          "designRole": "Streams raw rows to SheetParser and replaces buffer with the decoded sheet so it can be read again without decoding the workbook.",
          "userFlow": true,
          "changeType": "modified"
        },
        {
          "name": "collectDiagnostics",
          "generalDescription": "Collects diagnostics produced while reading and parsing a workbook.",
          "designRole": "Makes sheet parsing warnings available for the import's final diagnostic summary.",
          "userFlow": true,
          "changeType": "added"
        }
      ],
      "variableExposure": [
        {
          "name": "buffer",
          "kind": "instance",
          "declaredAt": {
            "file": "src/import/reader/workbook-reader.ts",
            "line": 20,
            "column": 3
          }
        },
        {
          "name": "index1",
          "kind": "instance",
          "declaredAt": {
            "file": "src/import/reader/workbook-reader.ts",
            "line": 24,
            "column": 4
          }
        },
        {
          "name": "logger",
          "kind": "local",
          "method": "open",
          "declaredAt": {
            "file": "src/import/reader/workbook-reader.ts",
            "line": 157,
            "column": 14
          }
        },
        {
          "name": "retries1",
          "kind": "local",
          "method": "open",
          "declaredAt": {
            "file": "src/import/reader/workbook-reader.ts",
            "line": 296,
            "column": 10
          }
        },
        {
          "name": "sheetBuffer",
          "kind": "parameter",
          "method": "readSheet",
          "declaredAt": {
            "file": "src/import/reader/workbook-reader.ts",
            "line": 108,
            "column": 5
          }
        },
        {
          "name": "result1",
          "kind": "parameter",
          "method": "readSheet",
          "declaredAt": {
            "file": "src/import/reader/workbook-reader.ts",
            "line": 295,
            "column": 8
          }
        }
      ],
      "variableExposureCount": 6
    },
    {
      "name": "SheetMapper",
      "generalDescription": "Maps sheet columns to target columns and converts sheet rows into target records.",
      "designRole": "Proposes a column mapping for user review, applies the confirmed mapping through TypeCoercer, and adds mapped rows to the run result.",
      "changeType": "added",
      "stateVariables": [],
      "methods": [
        {
          "name": "constructor",
          "generalDescription": "Initializes the sheet mapper and its dependencies.",
          "designRole": "Sets up the ColumnMatcher and TypeCoercer used for mapping proposals and cell conversion.",
          "userFlow": false,
          "changeType": "added"
        },
        {
          "name": "mapSheet",
          "generalDescription": "Transforms a parsed sheet into records using a column mapping.",
          "designRole": "Applies the mapping accepted in Mapping Review, coerces each cell to its target type, and appends mapped rows to the orchestrator's result.",
          "userFlow": true,
          "changeType": "added"
        },
        {
          "name": "proposeColumns",
          "generalDescription": "Prepares a proposed mapping from sheet headers to target columns.",
          "designRole": "Asks ColumnMatcher to rank candidate columns and presents the suggested mapping and confidence scores in Mapping Review.",
          "userFlow": true,
          "changeType": "added"
        }
      ],
      "variableExposure": [],